
         /\      Grafana   /‾‾/  
    /\  /  \     |\  __   /  /   
   /  \/    \    | |/ /  /   ‾‾\ 
  /          \   |   (  |  (‾)  |
 / __________ \  |_|\_\  \_____/ 

     execution: local
        script: tests/load/rest_api_test.js
        output: json (results_rest_api.json)

     scenarios: (100.00%) 1 scenario, 500 max VUs, 5m0s max duration (incl. graceful stop):
              * default: Up to 500 looping VUs for 4m30s over 5 stages (gracefulRampDown: 30s, gracefulStop: 30s)


running (0m00.8s), 003/500 VUs, 0 complete and 0 interrupted iterations
default   [   0% ] 003/500 VUs  0m00.7s/4m30.0s

running (0m01.8s), 006/500 VUs, 3 complete and 0 interrupted iterations
default   [   1% ] 006/500 VUs  0m01.7s/4m30.0s

running (0m02.8s), 009/500 VUs, 9 complete and 0 interrupted iterations
default   [   1% ] 009/500 VUs  0m02.7s/4m30.0s

running (0m03.8s), 013/500 VUs, 18 complete and 0 interrupted iterations
default   [   1% ] 013/500 VUs  0m03.7s/4m30.0s

running (0m04.8s), 016/500 VUs, 30 complete and 0 interrupted iterations
default   [   2% ] 016/500 VUs  0m04.7s/4m30.0s

running (0m05.8s), 019/500 VUs, 46 complete and 0 interrupted iterations
default   [   2% ] 019/500 VUs  0m05.7s/4m30.0s

running (0m06.8s), 023/500 VUs, 65 complete and 0 interrupted iterations
default   [   2% ] 023/500 VUs  0m06.7s/4m30.0s

running (0m07.8s), 026/500 VUs, 86 complete and 0 interrupted iterations
default   [   3% ] 026/500 VUs  0m07.7s/4m30.0s

running (0m08.8s), 029/500 VUs, 112 complete and 0 interrupted iterations
default   [   3% ] 029/500 VUs  0m08.7s/4m30.0s

running (0m09.8s), 032/500 VUs, 141 complete and 0 interrupted iterations
default   [   4% ] 032/500 VUs  0m09.7s/4m30.0s

running (0m10.8s), 036/500 VUs, 173 complete and 0 interrupted iterations
default   [   4% ] 036/500 VUs  0m10.7s/4m30.0s

running (0m11.8s), 039/500 VUs, 209 complete and 0 interrupted iterations
default   [   4% ] 039/500 VUs  0m11.7s/4m30.0s

running (0m12.8s), 042/500 VUs, 247 complete and 0 interrupted iterations
default   [   5% ] 042/500 VUs  0m12.7s/4m30.0s

running (0m13.8s), 046/500 VUs, 286 complete and 0 interrupted iterations
default   [   5% ] 046/500 VUs  0m13.7s/4m30.0s

running (0m14.8s), 049/500 VUs, 332 complete and 0 interrupted iterations
default   [   5% ] 049/500 VUs  0m14.7s/4m30.0s

running (0m15.8s), 052/500 VUs, 380 complete and 0 interrupted iterations
default   [   6% ] 052/500 VUs  0m15.7s/4m30.0s

running (0m16.8s), 056/500 VUs, 432 complete and 0 interrupted iterations
default   [   6% ] 056/500 VUs  0m16.7s/4m30.0s

running (0m17.8s), 059/500 VUs, 484 complete and 0 interrupted iterations
default   [   7% ] 059/500 VUs  0m17.7s/4m30.0s

running (0m18.8s), 062/500 VUs, 526 complete and 0 interrupted iterations
default   [   7% ] 062/500 VUs  0m18.7s/4m30.0s

running (0m19.8s), 065/500 VUs, 588 complete and 0 interrupted iterations
default   [   7% ] 065/500 VUs  0m19.7s/4m30.0s

running (0m20.8s), 069/500 VUs, 646 complete and 0 interrupted iterations
default   [   8% ] 069/500 VUs  0m20.7s/4m30.0s

running (0m21.8s), 072/500 VUs, 708 complete and 0 interrupted iterations
default   [   8% ] 072/500 VUs  0m21.7s/4m30.0s

running (0m22.8s), 075/500 VUs, 748 complete and 0 interrupted iterations
default   [   8% ] 075/500 VUs  0m22.7s/4m30.0s

running (0m23.8s), 079/500 VUs, 817 complete and 0 interrupted iterations
default   [   9% ] 079/500 VUs  0m23.7s/4m30.0s

running (0m24.8s), 082/500 VUs, 896 complete and 0 interrupted iterations
default   [   9% ] 082/500 VUs  0m24.7s/4m30.0s

running (0m25.8s), 085/500 VUs, 956 complete and 0 interrupted iterations
default   [  10% ] 085/500 VUs  0m25.7s/4m30.0s

running (0m26.8s), 088/500 VUs, 1014 complete and 0 interrupted iterations
default   [  10% ] 088/500 VUs  0m26.7s/4m30.0s

running (0m27.8s), 092/500 VUs, 1096 complete and 0 interrupted iterations
default   [  10% ] 092/500 VUs  0m27.7s/4m30.0s

running (0m28.8s), 095/500 VUs, 1188 complete and 0 interrupted iterations
default   [  11% ] 095/500 VUs  0m28.7s/4m30.0s

running (0m29.8s), 098/500 VUs, 1223 complete and 0 interrupted iterations
default   [  11% ] 098/500 VUs  0m29.7s/4m30.0s

running (0m30.8s), 100/500 VUs, 1321 complete and 0 interrupted iterations
default   [  11% ] 100/500 VUs  0m30.7s/4m30.0s

running (0m31.8s), 100/500 VUs, 1393 complete and 0 interrupted iterations
default   [  12% ] 100/500 VUs  0m31.7s/4m30.0s

running (0m32.8s), 100/500 VUs, 1429 complete and 0 interrupted iterations
default   [  12% ] 100/500 VUs  0m32.7s/4m30.0s

running (0m33.8s), 100/500 VUs, 1529 complete and 0 interrupted iterations
default   [  12% ] 100/500 VUs  0m33.7s/4m30.0s

running (0m34.8s), 100/500 VUs, 1555 complete and 0 interrupted iterations
default   [  13% ] 100/500 VUs  0m34.7s/4m30.0s

running (0m35.8s), 100/500 VUs, 1649 complete and 0 interrupted iterations
default   [  13% ] 100/500 VUs  0m35.7s/4m30.0s

running (0m36.8s), 100/500 VUs, 1749 complete and 0 interrupted iterations
default   [  14% ] 100/500 VUs  0m36.7s/4m30.0s

running (0m37.8s), 100/500 VUs, 1792 complete and 0 interrupted iterations
default   [  14% ] 100/500 VUs  0m37.7s/4m30.0s

running (0m38.8s), 100/500 VUs, 1892 complete and 0 interrupted iterations
default   [  14% ] 100/500 VUs  0m38.7s/4m30.0s

running (0m39.8s), 100/500 VUs, 1962 complete and 0 interrupted iterations
default   [  15% ] 100/500 VUs  0m39.7s/4m30.0s

running (0m40.8s), 100/500 VUs, 1992 complete and 0 interrupted iterations
default   [  15% ] 100/500 VUs  0m40.7s/4m30.0s

running (0m41.8s), 100/500 VUs, 2092 complete and 0 interrupted iterations
default   [  15% ] 100/500 VUs  0m41.7s/4m30.0s

running (0m42.8s), 100/500 VUs, 2095 complete and 0 interrupted iterations
default   [  16% ] 100/500 VUs  0m42.7s/4m30.0s

running (0m43.8s), 100/500 VUs, 2195 complete and 0 interrupted iterations
default   [  16% ] 100/500 VUs  0m43.7s/4m30.0s

running (0m44.8s), 100/500 VUs, 2295 complete and 0 interrupted iterations
default   [  17% ] 100/500 VUs  0m44.7s/4m30.0s

running (0m45.8s), 100/500 VUs, 2305 complete and 0 interrupted iterations
default   [  17% ] 100/500 VUs  0m45.7s/4m30.0s

running (0m46.8s), 100/500 VUs, 2405 complete and 0 interrupted iterations
default   [  17% ] 100/500 VUs  0m46.7s/4m30.0s

running (0m47.8s), 100/500 VUs, 2421 complete and 0 interrupted iterations
default   [  18% ] 100/500 VUs  0m47.7s/4m30.0s

running (0m48.8s), 100/500 VUs, 2521 complete and 0 interrupted iterations
default   [  18% ] 100/500 VUs  0m48.7s/4m30.0s

running (0m49.8s), 100/500 VUs, 2527 complete and 0 interrupted iterations
default   [  18% ] 100/500 VUs  0m49.7s/4m30.0s

running (0m50.8s), 100/500 VUs, 2627 complete and 0 interrupted iterations
default   [  19% ] 100/500 VUs  0m50.7s/4m30.0s

running (0m51.8s), 100/500 VUs, 2727 complete and 0 interrupted iterations
default   [  19% ] 100/500 VUs  0m51.7s/4m30.0s

running (0m52.8s), 100/500 VUs, 2730 complete and 0 interrupted iterations
default   [  20% ] 100/500 VUs  0m52.7s/4m30.0s

running (0m53.8s), 100/500 VUs, 2830 complete and 0 interrupted iterations
default   [  20% ] 100/500 VUs  0m53.7s/4m30.0s

running (0m54.8s), 100/500 VUs, 2841 complete and 0 interrupted iterations
default   [  20% ] 100/500 VUs  0m54.7s/4m30.0s

running (0m55.8s), 100/500 VUs, 2941 complete and 0 interrupted iterations
default   [  21% ] 100/500 VUs  0m55.7s/4m30.0s

running (0m56.8s), 100/500 VUs, 2947 complete and 0 interrupted iterations
default   [  21% ] 100/500 VUs  0m56.7s/4m30.0s

running (0m57.8s), 100/500 VUs, 3047 complete and 0 interrupted iterations
default   [  21% ] 100/500 VUs  0m57.7s/4m30.0s

running (0m58.8s), 100/500 VUs, 3147 complete and 0 interrupted iterations
default   [  22% ] 100/500 VUs  0m58.7s/4m30.0s

running (0m59.8s), 100/500 VUs, 3153 complete and 0 interrupted iterations
default   [  22% ] 100/500 VUs  0m59.7s/4m30.0s

running (1m00.8s), 100/500 VUs, 3253 complete and 0 interrupted iterations
default   [  22% ] 100/500 VUs  1m00.7s/4m30.0s

running (1m01.8s), 100/500 VUs, 3253 complete and 0 interrupted iterations
default   [  23% ] 100/500 VUs  1m01.7s/4m30.0s

running (1m02.8s), 100/500 VUs, 3353 complete and 0 interrupted iterations
default   [  23% ] 100/500 VUs  1m02.7s/4m30.0s

running (1m03.8s), 100/500 VUs, 3362 complete and 0 interrupted iterations
default   [  24% ] 100/500 VUs  1m03.7s/4m30.0s

running (1m04.8s), 100/500 VUs, 3462 complete and 0 interrupted iterations
default   [  24% ] 100/500 VUs  1m04.7s/4m30.0s

running (1m05.8s), 100/500 VUs, 3467 complete and 0 interrupted iterations
default   [  24% ] 100/500 VUs  1m05.7s/4m30.0s

running (1m06.8s), 100/500 VUs, 3567 complete and 0 interrupted iterations
default   [  25% ] 100/500 VUs  1m06.7s/4m30.0s

running (1m07.8s), 100/500 VUs, 3662 complete and 0 interrupted iterations
default   [  25% ] 100/500 VUs  1m07.7s/4m30.0s

running (1m08.8s), 100/500 VUs, 3676 complete and 0 interrupted iterations
default   [  25% ] 100/500 VUs  1m08.7s/4m30.0s

running (1m09.8s), 100/500 VUs, 3775 complete and 0 interrupted iterations
default   [  26% ] 100/500 VUs  1m09.7s/4m30.0s

running (1m10.8s), 100/500 VUs, 3779 complete and 0 interrupted iterations
default   [  26% ] 100/500 VUs  1m10.7s/4m30.0s

running (1m11.8s), 100/500 VUs, 3879 complete and 0 interrupted iterations
default   [  27% ] 100/500 VUs  1m11.7s/4m30.0s

running (1m12.8s), 100/500 VUs, 3896 complete and 0 interrupted iterations
default   [  27% ] 100/500 VUs  1m12.7s/4m30.0s

running (1m13.8s), 100/500 VUs, 3996 complete and 0 interrupted iterations
default   [  27% ] 100/500 VUs  1m13.7s/4m30.0s

running (1m14.8s), 100/500 VUs, 4081 complete and 0 interrupted iterations
default   [  28% ] 100/500 VUs  1m14.7s/4m30.0s

running (1m15.8s), 100/500 VUs, 4096 complete and 0 interrupted iterations
default   [  28% ] 100/500 VUs  1m15.7s/4m30.0s

running (1m16.8s), 100/500 VUs, 4196 complete and 0 interrupted iterations
default   [  28% ] 100/500 VUs  1m16.7s/4m30.0s

running (1m17.8s), 100/500 VUs, 4196 complete and 0 interrupted iterations
default   [  29% ] 100/500 VUs  1m17.7s/4m30.0s

running (1m18.8s), 100/500 VUs, 4296 complete and 0 interrupted iterations
default   [  29% ] 100/500 VUs  1m18.7s/4m30.0s

running (1m19.8s), 100/500 VUs, 4296 complete and 0 interrupted iterations
default   [  30% ] 100/500 VUs  1m19.7s/4m30.0s

running (1m20.8s), 100/500 VUs, 4396 complete and 0 interrupted iterations
default   [  30% ] 100/500 VUs  1m20.7s/4m30.0s

running (1m21.8s), 100/500 VUs, 4397 complete and 0 interrupted iterations
default   [  30% ] 100/500 VUs  1m21.7s/4m30.0s

running (1m22.8s), 100/500 VUs, 4497 complete and 0 interrupted iterations
default   [  31% ] 100/500 VUs  1m22.7s/4m30.0s

running (1m23.8s), 100/500 VUs, 4497 complete and 0 interrupted iterations
default   [  31% ] 100/500 VUs  1m23.7s/4m30.0s

running (1m24.8s), 100/500 VUs, 4597 complete and 0 interrupted iterations
default   [  31% ] 100/500 VUs  1m24.7s/4m30.0s

running (1m25.8s), 100/500 VUs, 4597 complete and 0 interrupted iterations
default   [  32% ] 100/500 VUs  1m25.7s/4m30.0s

running (1m26.8s), 100/500 VUs, 4697 complete and 0 interrupted iterations
default   [  32% ] 100/500 VUs  1m26.7s/4m30.0s

running (1m27.8s), 100/500 VUs, 4703 complete and 0 interrupted iterations
default   [  32% ] 100/500 VUs  1m27.7s/4m30.0s

running (1m28.8s), 100/500 VUs, 4803 complete and 0 interrupted iterations
default   [  33% ] 100/500 VUs  1m28.7s/4m30.0s

running (1m29.8s), 100/500 VUs, 4813 complete and 0 interrupted iterations
default   [  33% ] 100/500 VUs  1m29.7s/4m30.0s

running (1m30.8s), 108/500 VUs, 4913 complete and 0 interrupted iterations
default   [  34% ] 108/500 VUs  1m30.7s/4m30.0s

running (1m31.8s), 122/500 VUs, 4917 complete and 0 interrupted iterations
default   [  34% ] 122/500 VUs  1m31.7s/4m30.0s

running (1m32.8s), 135/500 VUs, 5038 complete and 0 interrupted iterations
default   [  34% ] 135/500 VUs  1m32.7s/4m30.0s

running (1m33.8s), 148/500 VUs, 5049 complete and 0 interrupted iterations
default   [  35% ] 148/500 VUs  1m33.7s/4m30.0s

running (1m34.8s), 162/500 VUs, 5197 complete and 0 interrupted iterations
default   [  35% ] 162/500 VUs  1m34.7s/4m30.0s

running (1m35.8s), 175/500 VUs, 5198 complete and 0 interrupted iterations
default   [  35% ] 175/500 VUs  1m35.7s/4m30.0s

running (1m36.8s), 188/500 VUs, 5373 complete and 0 interrupted iterations
default   [  36% ] 188/500 VUs  1m36.7s/4m30.0s

running (1m37.8s), 202/500 VUs, 5396 complete and 0 interrupted iterations
default   [  36% ] 202/500 VUs  1m37.7s/4m30.0s

running (1m38.8s), 215/500 VUs, 5429 complete and 0 interrupted iterations
default   [  37% ] 215/500 VUs  1m38.7s/4m30.0s

running (1m39.8s), 228/500 VUs, 5610 complete and 0 interrupted iterations
default   [  37% ] 228/500 VUs  1m39.7s/4m30.0s

running (1m40.8s), 242/500 VUs, 5610 complete and 0 interrupted iterations
default   [  37% ] 242/500 VUs  1m40.7s/4m30.0s

running (1m41.8s), 255/500 VUs, 5827 complete and 0 interrupted iterations
default   [  38% ] 255/500 VUs  1m41.7s/4m30.0s

running (1m42.8s), 268/500 VUs, 5873 complete and 0 interrupted iterations
default   [  38% ] 268/500 VUs  1m42.7s/4m30.0s

running (1m43.8s), 282/500 VUs, 5888 complete and 0 interrupted iterations
default   [  38% ] 282/500 VUs  1m43.7s/4m30.0s

running (1m44.8s), 295/500 VUs, 6136 complete and 0 interrupted iterations
default   [  39% ] 295/500 VUs  1m44.7s/4m30.0s

running (1m45.8s), 308/500 VUs, 6223 complete and 0 interrupted iterations
default   [  39% ] 308/500 VUs  1m45.7s/4m30.0s

running (1m46.8s), 322/500 VUs, 6223 complete and 0 interrupted iterations
default   [  40% ] 322/500 VUs  1m46.7s/4m30.0s

running (1m47.8s), 335/500 VUs, 6231 complete and 0 interrupted iterations
default   [  40% ] 335/500 VUs  1m47.7s/4m30.0s

running (1m48.8s), 348/500 VUs, 6566 complete and 0 interrupted iterations
default   [  40% ] 348/500 VUs  1m48.7s/4m30.0s

running (1m49.8s), 362/500 VUs, 6591 complete and 0 interrupted iterations
default   [  41% ] 362/500 VUs  1m49.7s/4m30.0s

running (1m50.8s), 375/500 VUs, 6606 complete and 0 interrupted iterations
default   [  41% ] 375/500 VUs  1m50.7s/4m30.0s

running (1m51.8s), 388/500 VUs, 6616 complete and 0 interrupted iterations
default   [  41% ] 388/500 VUs  1m51.7s/4m30.0s

running (1m52.8s), 402/500 VUs, 7004 complete and 0 interrupted iterations
default   [  42% ] 402/500 VUs  1m52.7s/4m30.0s

running (1m53.8s), 415/500 VUs, 7005 complete and 0 interrupted iterations
default   [  42% ] 415/500 VUs  1m53.7s/4m30.0s

running (1m54.8s), 428/500 VUs, 7021 complete and 0 interrupted iterations
default   [  42% ] 428/500 VUs  1m54.7s/4m30.0s

running (1m55.8s), 442/500 VUs, 7161 complete and 0 interrupted iterations
default   [  43% ] 442/500 VUs  1m55.7s/4m30.0s

running (1m56.8s), 455/500 VUs, 7429 complete and 0 interrupted iterations
default   [  43% ] 455/500 VUs  1m56.7s/4m30.0s

running (1m57.8s), 468/500 VUs, 7439 complete and 0 interrupted iterations
default   [  44% ] 468/500 VUs  1m57.7s/4m30.0s

running (1m58.8s), 482/500 VUs, 7448 complete and 0 interrupted iterations
default   [  44% ] 482/500 VUs  1m58.7s/4m30.0s

running (1m59.8s), 495/500 VUs, 7560 complete and 0 interrupted iterations
default   [  44% ] 495/500 VUs  1m59.7s/4m30.0s

running (2m00.8s), 500/500 VUs, 7604 complete and 0 interrupted iterations
default   [  45% ] 500/500 VUs  2m00.7s/4m30.0s

running (2m01.8s), 500/500 VUs, 7888 complete and 0 interrupted iterations
default   [  45% ] 500/500 VUs  2m01.7s/4m30.0s

running (2m02.8s), 500/500 VUs, 7910 complete and 0 interrupted iterations
default   [  45% ] 500/500 VUs  2m02.7s/4m30.0s

running (2m03.8s), 500/500 VUs, 7992 complete and 0 interrupted iterations
default   [  46% ] 500/500 VUs  2m03.7s/4m30.0s

running (2m04.8s), 500/500 VUs, 8077 complete and 0 interrupted iterations
default   [  46% ] 500/500 VUs  2m04.7s/4m30.0s

running (2m05.8s), 500/500 VUs, 8091 complete and 0 interrupted iterations
default   [  47% ] 500/500 VUs  2m05.7s/4m30.0s

running (2m06.8s), 500/500 VUs, 8176 complete and 0 interrupted iterations
default   [  47% ] 500/500 VUs  2m06.7s/4m30.0s

running (2m07.8s), 500/500 VUs, 8577 complete and 0 interrupted iterations
default   [  47% ] 500/500 VUs  2m07.7s/4m30.0s

running (2m08.8s), 500/500 VUs, 8582 complete and 0 interrupted iterations
default   [  48% ] 500/500 VUs  2m08.7s/4m30.0s

running (2m09.8s), 500/500 VUs, 8591 complete and 0 interrupted iterations
default   [  48% ] 500/500 VUs  2m09.7s/4m30.0s

running (2m10.8s), 500/500 VUs, 8641 complete and 0 interrupted iterations
default   [  48% ] 500/500 VUs  2m10.7s/4m30.0s

running (2m11.8s), 500/500 VUs, 8642 complete and 0 interrupted iterations
default   [  49% ] 500/500 VUs  2m11.7s/4m30.0s

running (2m12.8s), 500/500 VUs, 9142 complete and 0 interrupted iterations
default   [  49% ] 500/500 VUs  2m12.7s/4m30.0s

running (2m13.8s), 500/500 VUs, 9142 complete and 0 interrupted iterations
default   [  50% ] 500/500 VUs  2m13.7s/4m30.0s

running (2m14.8s), 500/500 VUs, 9142 complete and 0 interrupted iterations
default   [  50% ] 500/500 VUs  2m14.7s/4m30.0s

running (2m15.8s), 500/500 VUs, 9149 complete and 0 interrupted iterations
default   [  50% ] 500/500 VUs  2m15.7s/4m30.0s

running (2m16.8s), 500/500 VUs, 9176 complete and 0 interrupted iterations
default   [  51% ] 500/500 VUs  2m16.7s/4m30.0s

running (2m17.8s), 500/500 VUs, 9642 complete and 0 interrupted iterations
default   [  51% ] 500/500 VUs  2m17.7s/4m30.0s

running (2m18.8s), 500/500 VUs, 9676 complete and 0 interrupted iterations
default   [  51% ] 500/500 VUs  2m18.7s/4m30.0s

running (2m19.8s), 500/500 VUs, 9710 complete and 0 interrupted iterations
default   [  52% ] 500/500 VUs  2m19.7s/4m30.0s

running (2m20.8s), 500/500 VUs, 9710 complete and 0 interrupted iterations
default   [  52% ] 500/500 VUs  2m20.7s/4m30.0s

running (2m21.8s), 500/500 VUs, 9710 complete and 0 interrupted iterations
default   [  52% ] 500/500 VUs  2m21.7s/4m30.0s

running (2m22.8s), 500/500 VUs, 10176 complete and 0 interrupted iterations
default   [  53% ] 500/500 VUs  2m22.7s/4m30.0s

running (2m23.8s), 500/500 VUs, 10210 complete and 0 interrupted iterations
default   [  53% ] 500/500 VUs  2m23.7s/4m30.0s

running (2m24.8s), 500/500 VUs, 10210 complete and 0 interrupted iterations
default   [  54% ] 500/500 VUs  2m24.7s/4m30.0s

running (2m25.8s), 500/500 VUs, 10211 complete and 0 interrupted iterations
default   [  54% ] 500/500 VUs  2m25.7s/4m30.0s

running (2m26.8s), 500/500 VUs, 10317 complete and 0 interrupted iterations
default   [  54% ] 500/500 VUs  2m26.7s/4m30.0s

running (2m27.8s), 500/500 VUs, 10711 complete and 0 interrupted iterations
default   [  55% ] 500/500 VUs  2m27.7s/4m30.0s

running (2m28.8s), 500/500 VUs, 10711 complete and 0 interrupted iterations
default   [  55% ] 500/500 VUs  2m28.7s/4m30.0s

running (2m29.8s), 500/500 VUs, 10711 complete and 0 interrupted iterations
default   [  55% ] 500/500 VUs  2m29.7s/4m30.0s

running (2m30.8s), 500/500 VUs, 10711 complete and 0 interrupted iterations
default   [  56% ] 500/500 VUs  2m30.7s/4m30.0s

running (2m31.8s), 500/500 VUs, 10711 complete and 0 interrupted iterations
default   [  56% ] 500/500 VUs  2m31.7s/4m30.0s

running (2m32.8s), 500/500 VUs, 11211 complete and 0 interrupted iterations
default   [  57% ] 500/500 VUs  2m32.7s/4m30.0s

running (2m33.8s), 500/500 VUs, 11212 complete and 0 interrupted iterations
default   [  57% ] 500/500 VUs  2m33.7s/4m30.0s

running (2m34.8s), 500/500 VUs, 11212 complete and 0 interrupted iterations
default   [  57% ] 500/500 VUs  2m34.7s/4m30.0s

running (2m35.8s), 500/500 VUs, 11223 complete and 0 interrupted iterations
default   [  58% ] 500/500 VUs  2m35.7s/4m30.0s

running (2m36.8s), 500/500 VUs, 11259 complete and 0 interrupted iterations
default   [  58% ] 500/500 VUs  2m36.7s/4m30.0s

running (2m37.8s), 500/500 VUs, 11723 complete and 0 interrupted iterations
default   [  58% ] 500/500 VUs  2m37.7s/4m30.0s

running (2m38.8s), 500/500 VUs, 11759 complete and 0 interrupted iterations
default   [  59% ] 500/500 VUs  2m38.7s/4m30.0s

running (2m39.8s), 500/500 VUs, 11759 complete and 0 interrupted iterations
default   [  59% ] 500/500 VUs  2m39.7s/4m30.0s

running (2m40.8s), 500/500 VUs, 11759 complete and 0 interrupted iterations
default   [  60% ] 500/500 VUs  2m40.7s/4m30.0s

running (2m41.8s), 500/500 VUs, 11759 complete and 0 interrupted iterations
default   [  60% ] 500/500 VUs  2m41.7s/4m30.0s

running (2m42.8s), 500/500 VUs, 12259 complete and 0 interrupted iterations
default   [  60% ] 500/500 VUs  2m42.7s/4m30.0s

running (2m43.8s), 500/500 VUs, 12265 complete and 0 interrupted iterations
default   [  61% ] 500/500 VUs  2m43.7s/4m30.0s

running (2m44.8s), 500/500 VUs, 12265 complete and 0 interrupted iterations
default   [  61% ] 500/500 VUs  2m44.7s/4m30.0s

running (2m45.8s), 500/500 VUs, 12284 complete and 0 interrupted iterations
default   [  61% ] 500/500 VUs  2m45.7s/4m30.0s

running (2m46.8s), 500/500 VUs, 12436 complete and 0 interrupted iterations
default   [  62% ] 500/500 VUs  2m46.7s/4m30.0s

running (2m47.8s), 500/500 VUs, 12784 complete and 0 interrupted iterations
default   [  62% ] 500/500 VUs  2m47.7s/4m30.0s

running (2m48.8s), 500/500 VUs, 12784 complete and 0 interrupted iterations
default   [  62% ] 500/500 VUs  2m48.7s/4m30.0s

running (2m49.8s), 500/500 VUs, 12784 complete and 0 interrupted iterations
default   [  63% ] 500/500 VUs  2m49.7s/4m30.0s

running (2m50.8s), 500/500 VUs, 12784 complete and 0 interrupted iterations
default   [  63% ] 500/500 VUs  2m50.7s/4m30.0s

running (2m51.8s), 500/500 VUs, 13071 complete and 0 interrupted iterations
default   [  64% ] 500/500 VUs  2m51.7s/4m30.0s

running (2m52.8s), 500/500 VUs, 13286 complete and 0 interrupted iterations
default   [  64% ] 500/500 VUs  2m52.7s/4m30.0s

running (2m53.8s), 500/500 VUs, 13286 complete and 0 interrupted iterations
default   [  64% ] 500/500 VUs  2m53.7s/4m30.0s

running (2m54.8s), 500/500 VUs, 13286 complete and 0 interrupted iterations
default   [  65% ] 500/500 VUs  2m54.7s/4m30.0s

running (2m55.8s), 500/500 VUs, 13287 complete and 0 interrupted iterations
default   [  65% ] 500/500 VUs  2m55.7s/4m30.0s

running (2m56.8s), 500/500 VUs, 13326 complete and 0 interrupted iterations
default   [  65% ] 500/500 VUs  2m56.7s/4m30.0s

running (2m57.8s), 500/500 VUs, 13788 complete and 0 interrupted iterations
default   [  66% ] 500/500 VUs  2m57.7s/4m30.0s

running (2m58.8s), 500/500 VUs, 13788 complete and 0 interrupted iterations
default   [  66% ] 500/500 VUs  2m58.7s/4m30.0s

running (2m59.8s), 500/500 VUs, 13788 complete and 0 interrupted iterations
default   [  67% ] 500/500 VUs  2m59.7s/4m30.0s

running (3m00.8s), 500/500 VUs, 13788 complete and 0 interrupted iterations
default   [  67% ] 500/500 VUs  3m00.7s/4m30.0s

running (3m01.8s), 500/500 VUs, 13788 complete and 0 interrupted iterations
default   [  67% ] 500/500 VUs  3m01.7s/4m30.0s

running (3m02.8s), 500/500 VUs, 14288 complete and 0 interrupted iterations
default   [  68% ] 500/500 VUs  3m02.7s/4m30.0s

running (3m03.8s), 500/500 VUs, 14289 complete and 0 interrupted iterations
default   [  68% ] 500/500 VUs  3m03.7s/4m30.0s

running (3m04.8s), 500/500 VUs, 14309 complete and 0 interrupted iterations
default   [  68% ] 500/500 VUs  3m04.7s/4m30.0s

running (3m05.8s), 500/500 VUs, 14309 complete and 0 interrupted iterations
default   [  69% ] 500/500 VUs  3m05.7s/4m30.0s

running (3m06.8s), 500/500 VUs, 14309 complete and 0 interrupted iterations
default   [  69% ] 500/500 VUs  3m06.7s/4m30.0s

running (3m07.8s), 500/500 VUs, 14789 complete and 0 interrupted iterations
default   [  70% ] 500/500 VUs  3m07.7s/4m30.0s

running (3m08.8s), 500/500 VUs, 14809 complete and 0 interrupted iterations
default   [  70% ] 500/500 VUs  3m08.7s/4m30.0s

running (3m09.8s), 500/500 VUs, 14809 complete and 0 interrupted iterations
default   [  70% ] 500/500 VUs  3m09.7s/4m30.0s

running (3m10.8s), 500/500 VUs, 14809 complete and 0 interrupted iterations
default   [  71% ] 500/500 VUs  3m10.7s/4m30.0s

running (3m11.8s), 500/500 VUs, 14809 complete and 0 interrupted iterations
default   [  71% ] 500/500 VUs  3m11.7s/4m30.0s

running (3m12.8s), 500/500 VUs, 15309 complete and 0 interrupted iterations
default   [  71% ] 500/500 VUs  3m12.7s/4m30.0s

running (3m13.8s), 500/500 VUs, 15335 complete and 0 interrupted iterations
default   [  72% ] 500/500 VUs  3m13.7s/4m30.0s

running (3m14.8s), 500/500 VUs, 15338 complete and 0 interrupted iterations
default   [  72% ] 500/500 VUs  3m14.7s/4m30.0s

running (3m15.8s), 500/500 VUs, 15338 complete and 0 interrupted iterations
default   [  72% ] 500/500 VUs  3m15.7s/4m30.0s

running (3m16.8s), 500/500 VUs, 15338 complete and 0 interrupted iterations
default   [  73% ] 500/500 VUs  3m16.7s/4m30.0s

running (3m17.8s), 500/500 VUs, 15835 complete and 0 interrupted iterations
default   [  73% ] 500/500 VUs  3m17.7s/4m30.0s

running (3m18.8s), 500/500 VUs, 15842 complete and 0 interrupted iterations
default   [  74% ] 500/500 VUs  3m18.7s/4m30.0s

running (3m19.8s), 500/500 VUs, 15842 complete and 0 interrupted iterations
default   [  74% ] 500/500 VUs  3m19.7s/4m30.0s

running (3m20.8s), 500/500 VUs, 15842 complete and 0 interrupted iterations
default   [  74% ] 500/500 VUs  3m20.7s/4m30.0s

running (3m21.8s), 500/500 VUs, 15868 complete and 0 interrupted iterations
default   [  75% ] 500/500 VUs  3m21.7s/4m30.0s

running (3m22.8s), 500/500 VUs, 15977 complete and 0 interrupted iterations
default   [  75% ] 500/500 VUs  3m22.7s/4m30.0s

running (3m23.8s), 500/500 VUs, 16378 complete and 0 interrupted iterations
default   [  75% ] 500/500 VUs  3m23.7s/4m30.0s

running (3m24.8s), 500/500 VUs, 16398 complete and 0 interrupted iterations
default   [  76% ] 500/500 VUs  3m24.7s/4m30.0s

running (3m25.8s), 500/500 VUs, 16477 complete and 0 interrupted iterations
default   [  76% ] 500/500 VUs  3m25.7s/4m30.0s

running (3m26.8s), 500/500 VUs, 16477 complete and 0 interrupted iterations
default   [  77% ] 500/500 VUs  3m26.7s/4m30.0s

running (3m27.8s), 500/500 VUs, 16477 complete and 0 interrupted iterations
default   [  77% ] 500/500 VUs  3m27.7s/4m30.0s

running (3m28.8s), 500/500 VUs, 16608 complete and 0 interrupted iterations
default   [  77% ] 500/500 VUs  3m28.7s/4m30.0s

running (3m29.8s), 500/500 VUs, 16977 complete and 0 interrupted iterations
default   [  78% ] 500/500 VUs  3m29.7s/4m30.0s

running (3m30.8s), 500/500 VUs, 16977 complete and 0 interrupted iterations
default   [  78% ] 500/500 VUs  3m30.7s/4m30.0s

running (3m31.8s), 500/500 VUs, 16977 complete and 0 interrupted iterations
default   [  78% ] 500/500 VUs  3m31.7s/4m30.0s

running (3m32.8s), 500/500 VUs, 16977 complete and 0 interrupted iterations
default   [  79% ] 500/500 VUs  3m32.7s/4m30.0s

running (3m33.8s), 500/500 VUs, 16977 complete and 0 interrupted iterations
default   [  79% ] 500/500 VUs  3m33.7s/4m30.0s

running (3m34.8s), 500/500 VUs, 17477 complete and 0 interrupted iterations
default   [  80% ] 500/500 VUs  3m34.7s/4m30.0s

running (3m35.8s), 500/500 VUs, 17498 complete and 0 interrupted iterations
default   [  80% ] 500/500 VUs  3m35.7s/4m30.0s

running (3m36.8s), 500/500 VUs, 17498 complete and 0 interrupted iterations
default   [  80% ] 500/500 VUs  3m36.7s/4m30.0s

running (3m37.8s), 500/500 VUs, 17498 complete and 0 interrupted iterations
default   [  81% ] 500/500 VUs  3m37.7s/4m30.0s

running (3m38.8s), 500/500 VUs, 17498 complete and 0 interrupted iterations
default   [  81% ] 500/500 VUs  3m38.7s/4m30.0s

running (3m39.8s), 500/500 VUs, 17998 complete and 0 interrupted iterations
default   [  81% ] 500/500 VUs  3m39.7s/4m30.0s

running (3m40.8s), 500/500 VUs, 18000 complete and 0 interrupted iterations
default   [  82% ] 500/500 VUs  3m40.7s/4m30.0s

running (3m41.8s), 500/500 VUs, 18000 complete and 0 interrupted iterations
default   [  82% ] 500/500 VUs  3m41.7s/4m30.0s

running (3m42.8s), 500/500 VUs, 18012 complete and 0 interrupted iterations
default   [  82% ] 500/500 VUs  3m42.7s/4m30.0s

running (3m43.8s), 500/500 VUs, 18012 complete and 0 interrupted iterations
default   [  83% ] 500/500 VUs  3m43.7s/4m30.0s

running (3m44.8s), 500/500 VUs, 18500 complete and 0 interrupted iterations
default   [  83% ] 500/500 VUs  3m44.7s/4m30.0s

running (3m45.8s), 500/500 VUs, 18512 complete and 0 interrupted iterations
default   [  84% ] 500/500 VUs  3m45.7s/4m30.0s

running (3m46.8s), 500/500 VUs, 18512 complete and 0 interrupted iterations
default   [  84% ] 500/500 VUs  3m46.7s/4m30.0s

running (3m47.8s), 500/500 VUs, 18512 complete and 0 interrupted iterations
default   [  84% ] 500/500 VUs  3m47.7s/4m30.0s

running (3m48.8s), 500/500 VUs, 18551 complete and 0 interrupted iterations
default   [  85% ] 500/500 VUs  3m48.7s/4m30.0s

running (3m49.8s), 500/500 VUs, 18551 complete and 0 interrupted iterations
default   [  85% ] 500/500 VUs  3m49.7s/4m30.0s

running (3m50.8s), 500/500 VUs, 19051 complete and 0 interrupted iterations
default   [  85% ] 500/500 VUs  3m50.7s/4m30.0s

running (3m51.8s), 500/500 VUs, 19051 complete and 0 interrupted iterations
default   [  86% ] 500/500 VUs  3m51.7s/4m30.0s

running (3m52.8s), 500/500 VUs, 19051 complete and 0 interrupted iterations
default   [  86% ] 500/500 VUs  3m52.7s/4m30.0s

running (3m53.8s), 500/500 VUs, 19051 complete and 0 interrupted iterations
default   [  87% ] 500/500 VUs  3m53.7s/4m30.0s

running (3m54.8s), 500/500 VUs, 19063 complete and 0 interrupted iterations
default   [  87% ] 500/500 VUs  3m54.7s/4m30.0s

running (3m55.8s), 500/500 VUs, 19563 complete and 0 interrupted iterations
default   [  87% ] 500/500 VUs  3m55.7s/4m30.0s

running (3m56.8s), 500/500 VUs, 19563 complete and 0 interrupted iterations
default   [  88% ] 500/500 VUs  3m56.7s/4m30.0s

running (3m57.8s), 500/500 VUs, 19563 complete and 0 interrupted iterations
default   [  88% ] 500/500 VUs  3m57.7s/4m30.0s

running (3m58.8s), 500/500 VUs, 19563 complete and 0 interrupted iterations
default   [  88% ] 500/500 VUs  3m58.7s/4m30.0s

running (3m59.8s), 500/500 VUs, 19563 complete and 0 interrupted iterations
default   [  89% ] 500/500 VUs  3m59.7s/4m30.0s

running (4m00.8s), 500/500 VUs, 20063 complete and 0 interrupted iterations
default   [  89% ] 500/500 VUs  4m00.7s/4m30.0s

running (4m01.8s), 500/500 VUs, 20064 complete and 0 interrupted iterations
default   [  90% ] 500/500 VUs  4m01.7s/4m30.0s

running (4m02.8s), 500/500 VUs, 20064 complete and 0 interrupted iterations
default   [  90% ] 500/500 VUs  4m02.7s/4m30.0s

running (4m03.8s), 500/500 VUs, 20066 complete and 0 interrupted iterations
default   [  90% ] 500/500 VUs  4m03.7s/4m30.0s

running (4m04.8s), 500/500 VUs, 20066 complete and 0 interrupted iterations
default   [  91% ] 500/500 VUs  4m04.7s/4m30.0s

running (4m05.8s), 416/500 VUs, 20564 complete and 0 interrupted iterations
default   [  91% ] 416/500 VUs  4m05.7s/4m30.0s

running (4m06.8s), 415/500 VUs, 20566 complete and 0 interrupted iterations
default   [  91% ] 415/500 VUs  4m06.7s/4m30.0s

running (4m07.8s), 415/500 VUs, 20566 complete and 0 interrupted iterations
default   [  92% ] 415/500 VUs  4m07.7s/4m30.0s

running (4m08.8s), 415/500 VUs, 20567 complete and 0 interrupted iterations
default   [  92% ] 415/500 VUs  4m08.7s/4m30.0s

running (4m09.8s), 346/500 VUs, 20982 complete and 0 interrupted iterations
default   [  92% ] 346/500 VUs  4m09.7s/4m30.0s

running (4m10.8s), 346/500 VUs, 20983 complete and 0 interrupted iterations
default   [  93% ] 346/500 VUs  4m10.7s/4m30.0s

running (4m11.8s), 346/500 VUs, 20983 complete and 0 interrupted iterations
default   [  93% ] 346/500 VUs  4m11.7s/4m30.0s

running (4m12.8s), 346/500 VUs, 20983 complete and 0 interrupted iterations
default   [  94% ] 346/500 VUs  4m12.7s/4m30.0s

running (4m13.8s), 281/500 VUs, 21329 complete and 0 interrupted iterations
default   [  94% ] 281/500 VUs  4m13.7s/4m30.0s

running (4m14.8s), 281/500 VUs, 21337 complete and 0 interrupted iterations
default   [  94% ] 281/500 VUs  4m14.7s/4m30.0s

running (4m15.8s), 280/500 VUs, 21343 complete and 0 interrupted iterations
default   [  95% ] 280/500 VUs  4m15.7s/4m30.0s

running (4m16.8s), 225/500 VUs, 21609 complete and 0 interrupted iterations
default   [  95% ] 225/500 VUs  4m16.7s/4m30.0s

running (4m17.8s), 222/500 VUs, 21623 complete and 0 interrupted iterations
default   [  95% ] 222/500 VUs  4m17.7s/4m30.0s

running (4m18.8s), 222/500 VUs, 21623 complete and 0 interrupted iterations
default   [  96% ] 222/500 VUs  4m18.7s/4m30.0s

running (4m19.8s), 222/500 VUs, 21625 complete and 0 interrupted iterations
default   [  96% ] 222/500 VUs  4m19.7s/4m30.0s

running (4m20.8s), 168/500 VUs, 21847 complete and 0 interrupted iterations
default   [  97% ] 168/500 VUs  4m20.7s/4m30.0s

running (4m21.8s), 168/500 VUs, 21847 complete and 0 interrupted iterations
default   [  97% ] 168/500 VUs  4m21.7s/4m30.0s

running (4m22.8s), 126/500 VUs, 22015 complete and 0 interrupted iterations
default   [  97% ] 126/500 VUs  4m22.7s/4m30.0s

running (4m23.8s), 126/500 VUs, 22020 complete and 0 interrupted iterations
default   [  98% ] 126/500 VUs  4m23.7s/4m30.0s

running (4m24.8s), 124/500 VUs, 22033 complete and 0 interrupted iterations
default   [  98% ] 124/500 VUs  4m24.7s/4m30.0s

running (4m25.8s), 087/500 VUs, 22157 complete and 0 interrupted iterations
default   [  98% ] 087/500 VUs  4m25.7s/4m30.0s

running (4m26.8s), 060/500 VUs, 22244 complete and 0 interrupted iterations
default   [  99% ] 060/500 VUs  4m26.7s/4m30.0s

running (4m27.8s), 059/500 VUs, 22246 complete and 0 interrupted iterations
default   [  99% ] 059/500 VUs  4m27.7s/4m30.0s

running (4m28.8s), 035/500 VUs, 22305 complete and 0 interrupted iterations
default   [ 100% ] 035/500 VUs  4m28.7s/4m30.0s

running (4m29.8s), 014/500 VUs, 22340 complete and 0 interrupted iterations
default   [ 100% ] 014/500 VUs  4m29.7s/4m30.0s


  █ THRESHOLDS 

    errors
    ✗ 'rate<0.01' rate=100.00%

    http_req_duration
    ✗ 'p(95)<500' p(95)=1.65s

    http_req_failed
    ✗ 'rate<0.01' rate=100.00%


  █ TOTAL RESULTS 

    checks_total.......: 89416   330.655003/s
    checks_succeeded...: 0.00%   0 out of 89416
    checks_failed......: 100.00% 89416 out of 89416

    ✗ snapshot status is 200
      ↳  0% — ✓ 0 / ✗ 22354
    ✗ snapshot has data
      ↳  0% — ✓ 0 / ✗ 22354
    ✗ orderbook status is 200
      ↳  0% — ✓ 0 / ✗ 22354
    ✗ scenarios status is 200
      ↳  0% — ✓ 0 / ✗ 22354

    CUSTOM
    errors...............: 100.00% 22354 out of 22354
    latency_p95..........: 100.00% 7440 out of 7440

    HTTP
    http_req_duration....: avg=929.86ms min=1.67ms med=1.13s max=3.8s  p(90)=1.56s p(95)=1.65s
    http_req_failed......: 100.00% 67063 out of 67063
    http_reqs............: 67063   247.99495/s

    EXECUTION
    iteration_duration...: avg=3.79s    min=1s     med=4.59s max=7.28s p(90)=5.52s p(95)=5.65s
    iterations...........: 22354   82.663751/s
    vus..................: 14      min=3              max=500
    vus_max..............: 500     min=500            max=500

    NETWORK
    data_received........: 12 MB   44 kB/s
    data_sent............: 10 MB   38 kB/s




running (4m30.4s), 000/500 VUs, 22354 complete and 0 interrupted iterations
default ✓ [ 100% ] 000/500 VUs  4m30s
time="2025-12-10T02:05:15+01:00" level=error msg="thresholds on metrics 'errors, http_req_duration, http_req_failed' have been crossed"
